{
  "schema_version": "0.1.0",
  "case_id": "CASE-SHOCK-NO-TRADE-001",
  "case_version": "0.1.0",
  "symbol": "XAUUSD",
  "partition": "VALIDATION",
  "difficulty": "ADVANCED",
  "curriculum_tags": [
    "volatility",
    "permission",
    "process",
    "no_trade"
  ],
  "visible_steps": [
    {
      "step_id": "STEP-001",
      "snapshot_path": "visible/step_001.snapshot.json",
      "replay_time": "2025-03-03T05:00:00Z"
    }
  ],
  "hidden_outcome_path": "hidden/outcome.json",
  "judge_key_path": "hidden/judge_key.json",
  "locked_for_tuning": false
}